<company xmlns:xsi="http://www.w3.org/2001/XMLSchema-instance"
 xsi:noNamespaceSchemaLocation="company.xsd">
    <generalInfo multinational="false" currency="euro">
        <companyName>XML TECH</companyName>
        <numberEmployees number="6"/>
        <technology/>
    </generalInfo>
    <departmentInfo date="2023-02-03">
        <dept code="ADMIN" deptName="Administration">
            <staffInfo user="atorres">
                <name>Alicia</name>
                <surnames>Torres Pan</surnames>
                <role>Head of Department</role>
                <salary>2250</salary>
                <key>3%abYki6</key>
            </staffInfo>

            <staffInfo user="xaldrei">
                <name>Xoán</name>
                <surnames>Aldrei Soto</surnames>
                <role>Employee</role>
                <sickLeave/>
                <salary>1200</salary>
                <key>6@hjKm87</key>
            </staffInfo>

            <staffInfo user="amotar">
                <name>Ana</name>
                <surnames>Mota Rei</surnames>
                <role>Employee</role>
                <salary>1250.50</salary>
                <key>4%wtrtHQ</key>
            </staffInfo>
        </dept>

        <dept>

            <staffInfo user="obaltar">
                <name>Óscar</name>
                <surnames>Baltar Dacosta</surnames>
                <role>Head of Department</role>
                <sickLeave/>
                <salary>2300.75</salary>
                <key>8$abcdHj</key>
            </staffInfo>

            <staffInfo user="hvilar">
                <name>Helena</name>
                <surnames>Vilar Moure</surnames>
                <role>Employee</role>
                <salary>1500.35</salary>
                <key>9?sdKp:s</key>
            </staffInfo>
        </dept>

        <dept>
            <staffInfo user="guest">
                <name>Andrea</name>
                <surnames>Serodio Paz</surnames>
                <role>Head of Department</role>
                <salary>2500.85</salary>
                <key>2$xlzhYH</key>
            </staffInfo>
        </dept>
    </departmentInfo>
</company>
